{
 "schema_version": "nvi.analysis.v0.2",
 "analysis_id": "a_dcd5bbec8ea7",
 "video_id": "cd20b16879d630c4",
 "source_name": "clip",
 "duration_ms": 26100,
 "status": "complete",
 "research_only": true,
 "synthetic": true,
 "model_versions": {
  "neural": "tribe-roi-proxies_v0",
  "behavior": null,
  "explain": "neural-moments-0.1.0"
 },
 "provenance": {
  "tribe_commit": null,
  "roi_map": {
   "atlas": "HCPMMP1 (Glasser et al. 2016) on fsaverage, subset to fsaverage5",
   "annot": {
    "lh": {
     "url": "https://ndownloader.figshare.com/files/5528816",
     "md5": "46a102b59b2fb1bb4bd62d51bf02e975"
    },
    "rh": {
     "url": "https://ndownloader.figshare.com/files/5528819",
     "md5": "75e96b331940227bbcb07c1c791c2463"
    }
   },
   "groups_file": "roi_groups_v0.yaml",
   "groups_version": "roi_groups_v0",
   "groups_sha256": "1be6f03805d4885ffd11cfcca3798f2cfa9750d9107e5b0eb54e9f31dc8c8d65",
   "vertex_order": "lh 0..10241, rh 10242..20483 (TRIBE fsaverage5 order)",
   "n_parcels": 180,
   "group_vertex_counts": {
    "visual_early": 1328,
    "visual_motion": 208,
    "auditory": 367,
    "attention_dorsal": 1252,
    "attention_ventral": 701,
    "language": 1130,
    "social_tpj_sts": 981,
    "social_dmpfc": 532,
    "self_mpfc_pcc": 796,
    "value_vmpfc": 669,
    "control_dacc_dlpfc": 1260
   }
  },
  "proxies_version": "proxies_v0",
  "feature_version": "summary_v0",
  "normalization": "within_clip_z_excluding_onset"
 },
 "timing": {
  "time_base": "stimulus",
  "note": "TRIBE predictions are pre-shifted 5 s for hemodynamic lag; t=0 is the first video frame.",
  "native_tr_s": 1.0,
  "display_hz": 2,
  "n_display_samples": 53,
  "onset_window_ms": [
   0,
   2000
  ],
  "gaps_ms": []
 },
 "predictions": {
  "status": "not_available",
  "reason": "Behavior model not trained yet.",
  "metrics": {}
 },
 "channels": [
  {
   "key": "attention",
   "label": "Attention proxy",
   "kind": "neural_proxy",
   "unit": "z_within_clip",
   "direction": "hypothesis_positive",
   "direction_note": "Higher can be better, but compare against behavioral outcomes before relying on it.",
   "confidence": "uncalibrated",
   "source_model": "tribev2",
   "research_status": "research_proxy",
   "hz": 2,
   "native_tr_s": 1.0,
   "resampling": "sample_and_hold",
   "default_visible": true,
   "color": "#4F5BD5",
   "basis": {
    "roi_groups": [
     "attention_dorsal",
     "attention_ventral"
    ],
    "regions_text": "Dorsal attention (FEF / IPS) and ventral attention / salience (insula / frontal operculum)",
    "atlas": "HCP-MMP1"
   },
   "copy": {
    "tooltip": "Predicted response in attention and salience networks, relative to the rest of this clip.",
    "rise": "Strong predicted attention capture",
    "fall": "Predicted attention response falls"
   },
   "values": [
    -1.258,
    -1.258,
    -2.242,
    -2.242,
    0.453,
    0.453,
    0.14,
    0.14,
    -0.478,
    -0.478,
    1.448,
    1.448,
    -1.334,
    -1.334,
    -1.45,
    -1.45,
    -0.66,
    -0.66,
    -0.27,
    -0.27,
    -0.46,
    -0.46,
    0.005,
    0.005,
    1.618,
    1.618,
    -0.868,
    -0.868,
    1.089,
    1.089,
    0.366,
    0.366,
    0.166,
    0.166,
    -0.087,
    -0.087,
    0.125,
    0.125,
    -1.713,
    -1.713,
    -0.248,
    -0.248,
    1.234,
    1.234,
    -1.2,
    -1.2,
    2.06,
    2.06,
    1.399,
    1.399,
    -0.832,
    -0.832,
    -0.501
   ],
   "summary": {
    "mean_0_3s": -1.016,
    "mean_0_5s": -0.677,
    "peak_z": 2.06,
    "peak_time_ms": 23000,
    "trough_z": -2.242,
    "trough_time_ms": 1000,
    "stability": 0.396
   }
  },
  {
   "key": "social",
   "label": "Social relevance",
   "kind": "neural_proxy",
   "unit": "z_within_clip",
   "direction": "hypothesis_positive",
   "direction_note": "Hypothesized positive for sharing/transmission; not yet validated on our outcomes.",
   "confidence": "uncalibrated",
   "source_model": "tribev2",
   "research_status": "research_proxy",
   "hz": 2,
   "native_tr_s": 1.0,
   "resampling": "sample_and_hold",
   "default_visible": true,
   "color": "#2E8B57",
   "basis": {
    "roi_groups": [
     "social_tpj_sts",
     "social_dmpfc"
    ],
    "regions_text": "TPJ / posterior STS and dmPFC",
    "atlas": "HCP-MMP1"
   },
   "copy": {
    "tooltip": "Predicted response in networks associated with thinking about other people.",
    "rise": "Higher social-relevance proxy",
    "fall": "Social-relevance proxy drops"
   },
   "values": [
    0.278,
    0.278,
    0.589,
    0.589,
    -2.666,
    -2.666,
    -1.509,
    -1.509,
    0.061,
    0.061,
    1.277,
    1.277,
    0.622,
    0.622,
    -1.015,
    -1.015,
    -0.251,
    -0.251,
    0.08,
    0.08,
    -0.117,
    -0.117,
    -0.996,
    -0.996,
    -0.883,
    -0.883,
    0.618,
    0.618,
    0.62,
    0.62,
    0.685,
    0.685,
    -1.342,
    -1.342,
    0.549,
    0.549,
    0.932,
    0.932,
    -0.638,
    -0.638,
    -0.615,
    -0.615,
    1.201,
    1.201,
    1.186,
    1.186,
    -0.404,
    -0.404,
    1.197,
    1.197,
    0.333,
    0.333,
    1.077
   ],
   "summary": {
    "mean_0_3s": -0.6,
    "mean_0_5s": -0.649,
    "peak_z": 1.277,
    "peak_time_ms": 5000,
    "trough_z": -2.666,
    "trough_time_ms": 2000,
    "stability": 0.466
   }
  },
  {
   "key": "value",
   "label": "Value proxy",
   "kind": "neural_proxy",
   "unit": "z_within_clip",
   "direction": "hypothesis_positive",
   "direction_note": "Hypothesized positive; the public TRIBE checkpoint is cortical-only, so there is no striatal value signal.",
   "confidence": "uncalibrated",
   "source_model": "tribev2",
   "research_status": "research_proxy",
   "hz": 2,
   "native_tr_s": 1.0,
   "resampling": "sample_and_hold",
   "default_visible": true,
   "color": "#D9822B",
   "basis": {
    "roi_groups": [
     "value_vmpfc"
    ],
    "regions_text": "vmPFC / medial OFC (cortical proxy only; no NAcc in the TRIBE checkpoint)",
    "atlas": "HCP-MMP1"
   },
   "copy": {
    "tooltip": "Predicted response in cortical areas associated with subjective value.",
    "rise": "Higher cortical value proxy",
    "fall": "Cortical value proxy drops"
   },
   "values": [
    1.83,
    1.83,
    -0.557,
    -0.557,
    -0.867,
    -0.867,
    0.061,
    0.061,
    1.549,
    1.549,
    0.184,
    0.184,
    -0.615,
    -0.615,
    1.254,
    1.254,
    0.025,
    0.025,
    0.518,
    0.518,
    -0.312,
    -0.312,
    -0.618,
    -0.618,
    2.313,
    2.313,
    0.872,
    0.872,
    0.726,
    0.726,
    0.529,
    0.529,
    -0.29,
    -0.29,
    -0.965,
    -0.965,
    0.51,
    0.51,
    -0.553,
    -0.553,
    -2.711,
    -2.711,
    1.234,
    1.234,
    -0.614,
    -0.614,
    -0.382,
    -0.382,
    -0.56,
    -0.56,
    -0.454,
    -0.454,
    -0.836
   ],
   "summary": {
    "mean_0_3s": 0.135,
    "mean_0_5s": 0.403,
    "peak_z": 2.313,
    "peak_time_ms": 12000,
    "trough_z": -2.711,
    "trough_time_ms": 20000,
    "stability": 0.408
   }
  },
  {
   "key": "control",
   "label": "Cognitive-control response",
   "kind": "neural_proxy",
   "unit": "z_within_clip",
   "direction": "no_monotonic",
   "direction_note": "Do not read higher or lower as better. Preferred short videos have been associated with deactivation here; learn the sign from our own data.",
   "confidence": "uncalibrated",
   "source_model": "tribev2",
   "research_status": "research_proxy",
   "hz": 2,
   "native_tr_s": 1.0,
   "resampling": "sample_and_hold",
   "default_visible": true,
   "color": "#8E6CC0",
   "basis": {
    "roi_groups": [
     "control_dacc_dlpfc"
    ],
    "regions_text": "dACC and dlPFC",
    "atlas": "HCP-MMP1"
   },
   "copy": {
    "tooltip": "Predicted response in control networks. Neither direction is better by default.",
    "rise": "Control-network response rises",
    "fall": "Control-network response falls"
   },
   "values": [
    -0.42,
    -0.42,
    -1.924,
    -1.924,
    0.803,
    0.803,
    -1.649,
    -1.649,
    0.216,
    0.216,
    -0.451,
    -0.451,
    -1.303,
    -1.303,
    0.219,
    0.219,
    0.501,
    0.501,
    -0.761,
    -0.761,
    -1.235,
    -1.235,
    0.892,
    0.892,
    0.638,
    0.638,
    0.459,
    0.459,
    0.529,
    0.529,
    -0.038,
    -0.038,
    -1.863,
    -1.863,
    -0.405,
    -0.405,
    1.707,
    1.707,
    2.051,
    2.051,
    0.944,
    0.944,
    -1.212,
    -1.212,
    -1.356,
    -1.356,
    0.315,
    0.315,
    0.286,
    0.286,
    0.679,
    0.679,
    0.033
   ],
   "summary": {
    "mean_0_3s": -0.514,
    "mean_0_5s": -0.595,
    "peak_z": 2.051,
    "peak_time_ms": 19000,
    "trough_z": -1.924,
    "trough_time_ms": 1000,
    "stability": 0.439
   }
  },
  {
   "key": "self",
   "label": "Self relevance",
   "kind": "neural_proxy",
   "unit": "z_within_clip",
   "direction": "context_dependent",
   "direction_note": "Meaning depends on the content and the moment.",
   "confidence": "uncalibrated",
   "source_model": "tribev2",
   "research_status": "research_proxy",
   "hz": 2,
   "native_tr_s": 1.0,
   "resampling": "sample_and_hold",
   "default_visible": false,
   "color": "#C0507A",
   "basis": {
    "roi_groups": [
     "self_mpfc_pcc"
    ],
    "regions_text": "mPFC, PCC and precuneus",
    "atlas": "HCP-MMP1"
   },
   "copy": {
    "tooltip": "Predicted response in networks associated with self-related processing.",
    "rise": "Self-relevance proxy rises here",
    "fall": "Self-relevance proxy falls here"
   },
   "values": [
    0.344,
    0.344,
    0.75,
    0.75,
    1.71,
    1.71,
    -0.673,
    -0.673,
    0.275,
    0.275,
    1.186,
    1.186,
    0.664,
    0.664,
    1.618,
    1.618,
    -0.269,
    -0.269,
    -0.994,
    -0.994,
    0.242,
    0.242,
    -0.214,
    -0.214,
    -0.955,
    -0.955,
    -0.559,
    -0.559,
    0.849,
    0.849,
    -1.526,
    -1.526,
    0.406,
    0.406,
    0.103,
    0.103,
    -0.848,
    -0.848,
    1.251,
    1.251,
    -0.059,
    -0.059,
    -0.305,
    -0.305,